{
  "$schema": "https://json-schema.org/draft/2020-12/schema",
  "title": "League App data",
  "type": "object",
  "required": [
    "version",
    "updatedAt",
    "league",
    "teams",
    "players",
    "matches"
  ],
  "properties": {
    "version": {
      "type": "integer"
    },
    "updatedAt": {
      "type": "string"
    },
    "league": {
      "type": "object",
      "required": [
        "name",
        "season",
        "settings"
      ],
      "properties": {
        "name": {
          "type": "string"
        },
        "season": {
          "type": "string"
        },
        "logo": {
          "type": "string"
        },
        "country": {
          "type": "string"
        },
        "settings": {
          "type": "object"
        }
      }
    },
    "teams": {
      "type": "array",
      "items": {
        "type": "object",
        "required": [
          "id",
          "name"
        ]
      }
    },
    "players": {
      "type": "array",
      "items": {
        "type": "object",
        "required": [
          "id",
          "teamId",
          "name",
          "position"
        ]
      }
    },
    "matches": {
      "type": "array",
      "items": {
        "type": "object",
        "required": [
          "id",
          "round",
          "homeTeamId",
          "awayTeamId",
          "date",
          "status",
          "score"
        ]
      }
    },
    "events": {
      "type": "array"
    },
    "discipline": {
      "type": "array"
    },
    "ratings": {
      "type": "array"
    },
    "auditLog": {
      "type": "array"
    },
    "fanVotes": {
      "type": "array"
    }
  }
}