{
  "version": 1,
  "updatedAt": "2026-10-14T18:00:00.000Z",
  "league": {
    "name": "دوري المحترفين اليمني",
    "season": "2026/2027",
    "logo": "",
    "country": "YE",
    "settings": {
      "winPoints": 3,
      "drawPoints": 1,
      "lossPoints": 0,
      "yellowForSuspension": 3,
      "resetCardsAfterRounds": 0,
      "tiebreakers": [
        "points",
        "h2h",
        "h2hDiff",
        "h2hGoals",
        "diff",
        "goals",
        "wins",
        "fairplay",
        "draw"
      ],
      "pointsDeduction": [],
      "qualificationSpots": {
        "champions": 4,
        "europa": 2,
        "relegation": 3
      }
    }
  },
  "teams": [
    {
      "id": "t1",
      "name": "الهلال الساحلي",
      "shortName": "الهلال",
      "logo": "",
      "founded": 1968,
      "stadium": "ملعب الشهداء",
      "colors": { "primary": "#0B4EA2", "secondary": "#FFFFFF" },
      "coach": "سامي النعاش",
      "group": "A"
    },
    {
      "id": "t2",
      "name": "أهلي صنعاء",
      "shortName": "الأهلي",
      "logo": "",
      "founded": 1960,
      "stadium": "ملعب الظرافي",
      "colors": { "primary": "#C8102E", "secondary": "#FFD700" },
      "coach": "أمين السنيني",
      "group": "A"
    },
    {
      "id": "t3",
      "name": "الوحدة صنعاء",
      "shortName": "الوحدة",
      "logo": "",
      "founded": 1954,
      "stadium": "ملعب الوحدة",
      "colors": { "primary": "#00843D", "secondary": "#FFFFFF" },
      "coach": "محمد النفيعي",
      "group": "A"
    },
    {
      "id": "t4",
      "name": "شعب إب",
      "shortName": "الشعب",
      "logo": "",
      "founded": 1954,
      "stadium": "ملعب إب الدولي",
      "colors": { "primary": "#1E40AF", "secondary": "#FBBF24" },
      "coach": "أحمد علي",
      "group": "A"
    },
    {
      "id": "t5",
      "name": "اليرموك",
      "shortName": "اليرموك",
      "logo": "",
      "founded": 1975,
      "stadium": "ملعب اليرموك",
      "colors": { "primary": "#16A34A", "secondary": "#FFFFFF" },
      "coach": "خالد المهدي",
      "group": "A"
    },
    {
      "id": "t6",
      "name": "شباب الجيل",
      "shortName": "الجيل",
      "logo": "",
      "founded": 1978,
      "stadium": "ملعب الجيل",
      "colors": { "primary": "#000000", "secondary": "#FFD700" },
      "coach": "عبدالله الحداد",
      "group": "A"
    },
    {
      "id": "t7",
      "name": "التلال",
      "shortName": "التلال",
      "logo": "",
      "founded": 1964,
      "stadium": "ملعب التلال",
      "colors": { "primary": "#DC2626", "secondary": "#FFFFFF" },
      "coach": "علي الفقيه",
      "group": "B"
    },
    {
      "id": "t8",
      "name": "شعب حضرموت",
      "shortName": "شعب حضرموت",
      "logo": "",
      "founded": 1970,
      "stadium": "ملعب سيئون",
      "colors": { "primary": "#059669", "secondary": "#FCD34D" },
      "coach": "فهد بامطرف",
      "group": "B"
    },
    {
      "id": "t9",
      "name": "سلام الغرفة",
      "shortName": "السلام",
      "logo": "",
      "founded": 1982,
      "stadium": "ملعب الغرفة",
      "colors": { "primary": "#7C3AED", "secondary": "#FFFFFF" },
      "coach": "ناصر الجابري",
      "group": "B"
    },
    {
      "id": "t10",
      "name": "اتحاد حضرموت",
      "shortName": "اتحاد حضرموت",
      "logo": "",
      "founded": 1974,
      "stadium": "ملعب المكلا",
      "colors": { "primary": "#0891B2", "secondary": "#F97316" },
      "coach": "يوسف باحميد",
      "group": "B"
    },
    {
      "id": "t11",
      "name": "فجر عدن",
      "shortName": "فجر عدن",
      "logo": "",
      "founded": 1985,
      "stadium": "ملعب 22 مايو",
      "colors": { "primary": "#EA580C", "secondary": "#1E3A8A" },
      "coach": "سالم الحضرمي",
      "group": "B"
    },
    {
      "id": "t12",
      "name": "شمسان",
      "shortName": "شمسان",
      "logo": "",
      "founded": 1972,
      "stadium": "ملعب الشهيد الحبيشي",
      "colors": { "primary": "#F59E0B", "secondary": "#1F2937" },
      "coach": "عمار الردفاني",
      "group": "B"
    }
  ],
  "players": [
    { "id": "p1", "teamId": "t1", "name": "علي الحبيشي", "number": 1, "position": "GK", "birthdate": "1995-03-12", "nationality": "YE", "photo": "", "status": "active" },
    { "id": "p2", "teamId": "t1", "name": "ماجد الحكيمي", "number": 12, "position": "GK", "birthdate": "1998-07-22", "nationality": "YE", "photo": "", "status": "active" },
    { "id": "p3", "teamId": "t1", "name": "أحمد الصلوي", "number": 2, "position": "DF", "birthdate": "1996-05-08", "nationality": "YE", "photo": "", "status": "active" },
    { "id": "p4", "teamId": "t1", "name": "سالم العماري", "number": 3, "position": "DF", "birthdate": "1994-11-15", "nationality": "YE", "photo": "", "status": "active" },
    { "id": "p5", "teamId": "t1", "name": "محمد الفقيه", "number": 4, "position": "DF", "birthdate": "1997-02-20", "nationality": "YE", "photo": "", "status": "active" },
    { "id": "p6", "teamId": "t1", "name": "عبدالله المقطري", "number": 5, "position": "DF", "birthdate": "1993-09-03", "nationality": "YE", "photo": "", "status": "active" },
    { "id": "p7", "teamId": "t1", "name": "نايف الزبيري", "number": 6, "position": "DF", "birthdate": "1999-01-18", "nationality": "YE", "photo": "", "status": "active" },
    { "id": "p8", "teamId": "t1", "name": "أنس الشرعبي", "number": 13, "position": "DF", "birthdate": "2000-04-25", "nationality": "YE", "photo": "", "status": "active" },
    { "id": "p9", "teamId": "t1", "name": "وليد القباطي", "number": 7, "position": "MF", "birthdate": "1996-08-14", "nationality": "YE", "photo": "", "status": "active" },
    { "id": "p10", "teamId": "t1", "name": "جمال الحيمي", "number": 8, "position": "MF", "birthdate": "1995-12-05", "nationality": "YE", "photo": "", "status": "active" },
    { "id": "p11", "teamId": "t1", "name": "خالد الشرجبي", "number": 10, "position": "MF", "birthdate": "1997-06-30", "nationality": "YE", "photo": "", "status": "active" },
    { "id": "p12", "teamId": "t1", "name": "إبراهيم الحاشدي", "number": 14, "position": "MF", "birthdate": "1998-10-11", "nationality": "YE", "photo": "", "status": "active" },
    { "id": "p13", "teamId": "t1", "name": "عمار الأصبحي", "number": 16, "position": "MF", "birthdate": "1999-03-22", "nationality": "YE", "photo": "", "status": "active" },
    { "id": "p14", "teamId": "t1", "name": "فهد المخلافي", "number": 17, "position": "MF", "birthdate": "2001-05-09", "nationality": "YE", "photo": "", "status": "active" },
    { "id": "p15", "teamId": "t1", "name": "بشار العزي", "number": 18, "position": "MF", "birthdate": "2000-08-17", "nationality": "YE", "photo": "", "status": "active" },
    { "id": "p16", "teamId": "t1", "name": "أحمد العبسي", "number": 20, "position": "MF", "birthdate": "1997-11-28", "nationality": "YE", "photo": "", "status": "active" },
    { "id": "p17", "teamId": "t1", "name": "ياسر الجابري", "number": 9, "position": "FW", "birthdate": "1994-07-19", "nationality": "YE", "photo": "", "status": "active" },
    { "id": "p18", "teamId": "t1", "name": "سامي الحرازي", "number": 11, "position": "FW", "birthdate": "1996-01-25", "nationality": "YE", "photo": "", "status": "active" },
    { "id": "p19", "teamId": "t1", "name": "مروان الرعيني", "number": 19, "position": "FW", "birthdate": "1998-04-07", "nationality": "YE", "photo": "", "status": "active" },
    { "id": "p20", "teamId": "t1", "name": "زياد المطري", "number": 21, "position": "FW", "birthdate": "2000-09-14", "nationality": "YE", "photo": "", "status": "active" },

    { "id": "p21", "teamId": "t2", "name": "حسن الجرادي", "number": 1, "position": "GK", "birthdate": "1994-02-11", "nationality": "YE", "photo": "", "status": "active" },
    { "id": "p22", "teamId": "t2", "name": "أمين الوصابي", "number": 12, "position": "GK", "birthdate": "1997-06-19", "nationality": "YE", "photo": "", "status": "active" },
    { "id": "p23", "teamId": "t2", "name": "أحمد الشامي", "number": 2, "position": "DF", "birthdate": "1995-04-22", "nationality": "YE", "photo": "", "status": "active" },
    { "id": "p24", "teamId": "t2", "name": "ناصر الأهدل", "number": 3, "position": "DF", "birthdate": "1996-10-30", "nationality": "YE", "photo": "", "status": "active" },
    { "id": "p25", "teamId": "t2", "name": "عبدالرحمن الحبيشي", "number": 4, "position": "DF", "birthdate": "1993-08-15", "nationality": "YE", "photo": "", "status": "active" },
    { "id": "p26", "teamId": "t2", "name": "مراد الشامي", "number": 5, "position": "DF", "birthdate": "1997-01-12", "nationality": "YE", "photo": "", "status": "active" },
    { "id": "p27", "teamId": "t2", "name": "أيمن المقطري", "number": 6, "position": "DF", "birthdate": "1998-03-28", "nationality": "YE", "photo": "", "status": "active" },
    { "id": "p28", "teamId": "t2", "name": "سامي الحيمي", "number": 13, "position": "DF", "birthdate": "1999-07-08", "nationality": "YE", "photo": "", "status": "active" },
    { "id": "p29", "teamId": "t2", "name": "خالد الشيباني", "number": 7, "position": "MF", "birthdate": "1995-11-20", "nationality": "YE", "photo": "", "status": "active" },
    { "id": "p30", "teamId": "t2", "name": "أحمد الأصبحي", "number": 8, "position": "MF", "birthdate": "1996-05-15", "nationality": "YE", "photo": "", "status": "active" },
    { "id": "p31", "teamId": "t2", "name": "ياسر الشرعبي", "number": 10, "position": "MF", "birthdate": "1994-09-22", "nationality": "YE", "photo": "", "status": "active" },
    { "id": "p32", "teamId": "t2", "name": "فهد العزي", "number": 14, "position": "MF", "birthdate": "1998-02-18", "nationality": "YE", "photo": "", "status": "active" },
    { "id": "p33", "teamId": "t2", "name": "زياد الرعيني", "number": 16, "position": "MF", "birthdate": "1999-06-11", "nationality": "YE", "photo": "", "status": "active" },
    { "id": "p34", "teamId": "t2", "name": "إبراهيم المخلافي", "number": 17, "position": "MF", "birthdate": "2000-10-05", "nationality": "YE", "photo": "", "status": "active" },